id,question_variants,answer,category,source,tags,status,updated_at,priority
faq_001,"U-MOCO AIR 的主机保修多久？|这个产品保修多久？|主机保修期多久？|U-MOCO AIR 售后保修多久？","主机标准保修期为12个月，人为损坏不在标准保修范围内。",售后政策,售后政策手册V1,"保修,售后,主机",active,2026-05-02,1
faq_002,"U-MOCO AIR 支持哪些控制方式？|这个产品支持哪些控制方式？|机械臂支持哪些控制方式？","支持本地手柄控制、预设轨迹控制和联动控制，具体以当前产品说明书为准。",产品功能,产品FAQ,"控制方式,功能,机械臂",active,2026-05-02,1
faq_003,"如果客户需要定制方案怎么办？|客户要定制怎么办？|定制需求怎么处理？","定制方案需要由人工销售或技术同事进一步确认，AI仅提供通用信息。",转人工规则,客服规则,"定制,转人工",active,2026-05-02,1
faq_004,"可以直接给客户精准报价吗？|报价能不能直接说？|客户问价格怎么办？","涉及精准报价、合同条款或特殊商务条件时，需要由人工同事进一步确认，AI只提供通用信息。",转人工规则,客服规则,"报价,合同,转人工",active,2026-05-02,1
faq_005,"客户问价格能不能直接报？|这个多少钱？|能不能直接给客户报价？|报价能直接发吗？|价格现在能确认吗？","涉及精准报价、合同条款或特殊商务条件时，需要由人工同事进一步确认，AI只提供通用信息。",报价规则,客服规则,"报价,价格,商务,转人工",active,2026-05-02,1
faq_006,"合同条款能直接确认吗？|合同能直接答复吗？|协议条款现在能确认吗？|合同内容可以直接承诺吗？","涉及合同、协议、法律条款或正式商务承诺时，需要由人工同事进一步确认，AI只提供通用信息。",合同规则,客服规则,"合同,协议,法律,转人工",active,2026-05-02,1
faq_007,"客户要定制方案怎么办？|定制需求怎么处理？|客户要特殊方案怎么办？|个性化方案怎么回复？","客户提出定制需求或特殊方案时，需要由人工销售或技术同事进一步确认，AI仅提供通用信息。",转人工规则,客服规则,"定制,方案,转人工",active,2026-05-02,1
faq_008,"特殊售后怎么处理？|客户要求赔偿怎么办？|退款问题怎么回复？|补偿可以直接答应吗？","涉及特殊售后、赔偿、退款、补偿等问题时，需要由人工同事进一步确认，AI只提供通用信息。",转人工规则,客服规则,"售后,赔偿,退款,补偿",active,2026-05-02,1
faq_009,"交期能直接承诺吗？|多久发货能直接答吗？|什么时候能到可以直接说吗？|交付时间能直接确认吗？","涉及明确交期、发货时间或交付承诺时，需要由人工同事进一步确认，AI只提供通用信息。",商务规则,客服规则,"交期,发货,交付,承诺",active,2026-05-02,1